{
  "schema": "ActionIntent.v1",
  "spirit_id": "nibbles",
  "action_id": "nibbles-dry-run-scare-001",
  "proposed_by": "ms4_operator_dry_run",
  "action_type": "scare",
  "description": "Dry-run a jump-scare timing decision for a consenting guest without triggering hardware.",
  "inputs_used": [
    "consent_signal_lobe:detected",
    "proximity_safety_lobe:clear",
    "operator_dry_run:true"
  ],
  "risk_class": "high",
  "requires_safety_clearance": true,
  "payload": {
    "dry_run_only": true,
    "consent_from_subject": "detected",
    "physical_output_enabled": false,
    "planned_effect": "simulated_light_and_sound_cue"
  }
}
